{
  "id": 5,
  "name": "surf",
  "order": 14,
  "names": [
    {
      "name": "Surfen",
      "language": {
        "name": "de",
        "url": "/api/v2/language/6/"
      }
    },
    {
      "name": "Surfing",
      "language": {
        "name": "en",
        "url": "/api/v2/language/9/"
      }
    },
    {
      "name": "En surfant",
      "language": {
        "name": "fr",
        "url": "/api/v2/language/5/"
      }
    }
  ]
}